{
  "version": 1,
  "edition": "First Edition",
  "generatedAt": "2026-05-12T00:00:00.000Z",
  "sourceLabel": "Lane Genealogies Vol. I (1891) and linked site exhibits",
  "cards": [
    {
      "cardId": "william-lane-i",
      "personId": 4,
      "title": "William Lane (I)",
      "era": "Colonial Boston",
      "branch": "Boston anchor",
      "frontImage": "/family/assets/william-e-lane-boston-hero.png",
      "summary": "Opening exhibit anchor for the Lane chronology in colonial New England.",
      "facts": ["Freeman record in Massachusetts Bay, 1657.", "Family narrative links Boston, Hartford harmonization notes, and Lynn context."],
      "citations": [
        { "label": "Lane Genealogies Vol. I", "url": "https://archive.org/details/lanegenealogies01chap", "kind": "book", "pageRef": "Opening Boston line" }
      ],
      "tags": ["founder", "colonial", "boston"],
      "relatedCardIds": ["samuel-lane-ii", "john-lane-poole"],
      "rarity": "legendary",
      "timelineYear": 1625
    },
    {
      "cardId": "samuel-lane-ii",
      "personId": 6,
      "title": "Samuel Lane",
      "era": "King Philip's War era",
      "branch": "William I descendants",
      "frontImage": "/family/assets/lane-genealogies-title-spread.png",
      "summary": "Boston-born Samuel line with Hadley context and war-era mention in the compilation.",
      "facts": ["Boston register alignment in Jan 1651/2.", "Compilation cites Capt. Turner service context in 1676."],
      "citations": [{ "label": "Lane Genealogies Vol. I", "url": "https://archive.org/details/lanegenealogies01chap", "kind": "book" }],
      "tags": ["military-context", "hadley", "colonial"],
      "relatedCardIds": ["william-lane-i", "john-lane-poole"],
      "rarity": "rare",
      "timelineYear": 1651
    },
    {
      "cardId": "john-lane-poole",
      "personId": 7,
      "title": "John Lane",
      "era": "King Philip's War era",
      "branch": "William I descendants",
      "frontImage": "/family/assets/lane-genealogies-title-spread.png",
      "summary": "Cordwainer line with 1675 service mention under Capt. Poole in book text.",
      "facts": ["Born in Boston context, mid-1650s generation.", "Book narrative places him in March 1675 service context."],
      "citations": [{ "label": "Lane Genealogies Vol. I", "url": "https://archive.org/details/lanegenealogies01chap", "kind": "book" }],
      "tags": ["military-context", "boston", "craftsman"],
      "relatedCardIds": ["samuel-lane-ii", "william-lane-ii"],
      "rarity": "rare",
      "timelineYear": 1675
    },
    {
      "cardId": "william-lane-ii",
      "personId": 10,
      "title": "William Lane (II)",
      "era": "Late 17th century",
      "branch": "Webster-linked line",
      "frontImage": "/family/assets/lane-genealogies-title-spread.png",
      "summary": "Tailor line moving from Boston to Hampton in compilation records.",
      "facts": ["North Church Boston context appears in line notes.", "Hampton grant and civic references appear in the 1680s timeline."],
      "citations": [{ "label": "Lane Genealogies Vol. I", "url": "https://archive.org/details/lanegenealogies01chap", "kind": "book" }],
      "tags": ["migration", "hampton", "tailor"],
      "relatedCardIds": ["william-lane-i", "john-lane-libbey"],
      "rarity": "uncommon",
      "timelineYear": 1686
    },
    {
      "cardId": "sarah-dickinson-lane",
      "personId": 13,
      "title": "Sarah Dickinson Lane",
      "era": "Frontier household records",
      "branch": "Hadley strand",
      "frontImage": "/family/assets/lane-genealogies-title-spread.png",
      "summary": "Hadley household line and hardship narrative in frontier-era family text.",
      "facts": ["Appears in Samuel line narratives around Hadley and Suffield circles.", "Captivity-era wording is preserved as compilation narrative."],
      "citations": [{ "label": "Lane Genealogies Vol. I", "url": "https://archive.org/details/lanegenealogies01chap", "kind": "book" }],
      "tags": ["hadley", "frontier", "family-record"],
      "relatedCardIds": ["samuel-lane-ii"],
      "rarity": "uncommon",
      "timelineYear": 1704
    },
    {
      "cardId": "john-lane-libbey",
      "personId": 20,
      "title": "John Lane (Libbey marriage line)",
      "era": "Early 18th century",
      "branch": "Rye and Hampton links",
      "frontImage": "/family/assets/lane-genealogies-title-spread.png",
      "summary": "Rye marriage line joining Lane and Libbey mentions in the printed genealogy.",
      "facts": ["Birth context in Boston line appears in Vol. I.", "Marriage and Rye references connect to broader coastal family networks."],
      "citations": [{ "label": "Lane Genealogies Vol. I", "url": "https://archive.org/details/lanegenealogies01chap", "kind": "book" }],
      "tags": ["rye", "coastal", "marriage-line"],
      "relatedCardIds": ["mary-libbey-lane", "william-lane-ii"],
      "rarity": "uncommon",
      "timelineYear": 1709
    },
    {
      "cardId": "thomas-lane-sexton",
      "personId": 26,
      "title": "Thomas Lane (sexton)",
      "era": "Pre-Revolution church life",
      "branch": "Hampton parish",
      "frontImage": "/family/assets/lane-genealogies-title-spread.png",
      "summary": "Parish civic life card representing church and town continuity.",
      "facts": ["Named as sexton in Hampton church context.", "Used as civic continuity evidence rather than military evidence."],
      "citations": [{ "label": "Lane Genealogies Vol. I", "kind": "book", "url": "https://archive.org/details/lanegenealogies01chap" }],
      "tags": ["hampton", "church", "civic"],
      "relatedCardIds": ["william-lane-ii"],
      "rarity": "common",
      "timelineYear": 1775
    },
    {
      "cardId": "mary-libbey-lane",
      "personId": 35,
      "title": "Mary (Libbey) Lane",
      "era": "Rye and coastal New Hampshire",
      "branch": "Libbey connection",
      "frontImage": "/family/assets/lane-genealogies-title-spread.png",
      "summary": "Marriage-network card tying Rye-area family references to Lane descendants.",
      "facts": ["Libbey line appears in the same footnote cluster as Lane entries.", "Connects to coastal records in the Rye/Hampton orbit."],
      "citations": [{ "label": "Lane Genealogies Vol. I", "kind": "book", "url": "https://archive.org/details/lanegenealogies01chap" }],
      "tags": ["rye", "libbey", "coastal"],
      "relatedCardIds": ["john-lane-libbey"],
      "rarity": "uncommon",
      "timelineYear": 1685
    },
    {
      "cardId": "cornet-john-lane-iv",
      "personId": 36,
      "title": "Cornet John Lane",
      "era": "French and Indian frontier context",
      "branch": "Chester horse troop",
      "frontImage": "/family/assets/lane-genealogies-title-spread.png",
      "summary": "Mounted militia context card linked to Chester branch growth.",
      "facts": ["Compilation references a 1754 cornet appointment context.", "Forms parent generation context for later Revolutionary officers in branch narratives."],
      "citations": [{ "label": "Lane Genealogies Vol. I", "kind": "book", "url": "https://archive.org/details/lanegenealogies01chap" }],
      "tags": ["chester", "militia", "frontier"],
      "relatedCardIds": ["lt-ezekiel-lane", "lt-john-lane-bennington"],
      "rarity": "rare",
      "timelineYear": 1754
    },
    {
      "cardId": "lt-john-lane-bennington",
      "personId": 44,
      "title": "Lt. John Lane",
      "era": "Revolutionary War",
      "branch": "Chester branch officers",
      "frontImage": "/family/assets/lane-genealogies-title-spread.png",
      "summary": "Bennington-era officer narrative in the Chester branch cluster.",
      "facts": ["Book narrative places him in Dearborn company / Stickney regiment context.", "Promoted after family battlefield loss in the same campaign narrative."],
      "citations": [{ "label": "Lane war history page", "kind": "internal", "url": "/family/lane-war-history.html" }, { "label": "Lane Genealogies Vol. I", "kind": "book", "url": "https://archive.org/details/lanegenealogies01chap" }],
      "tags": ["revolution", "bennington", "officer"],
      "relatedCardIds": ["lt-ezekiel-lane", "daniel-lane-gale"],
      "rarity": "rare",
      "timelineYear": 1777
    },
    {
      "cardId": "daniel-lane-gale",
      "personId": 45,
      "title": "Daniel Lane",
      "era": "Revolutionary War",
      "branch": "Chester civic and service notes",
      "frontImage": "/family/assets/lane-genealogies-title-spread.png",
      "summary": "Civic contribution and short campaign deployment narrative in one card.",
      "facts": ["Compilation notes a 26-day 1778 New Jersey deployment context.", "Family civic memory includes cemetery and community references."],
      "citations": [{ "label": "Lane war history page", "kind": "internal", "url": "/family/lane-war-history.html" }, { "label": "Lane Genealogies Vol. I", "kind": "book", "url": "https://archive.org/details/lanegenealogies01chap" }],
      "tags": ["revolution", "chester", "civic"],
      "relatedCardIds": ["lt-john-lane-bennington"],
      "rarity": "uncommon",
      "timelineYear": 1778
    },
    {
      "cardId": "lt-ezekiel-lane",
      "personId": 46,
      "title": "Lt. Ezekiel Lane",
      "era": "Revolutionary War",
      "branch": "Chester branch officers",
      "frontImage": "/family/assets/lane-genealogies-title-spread.png",
      "summary": "Bennington casualty card central to the Chester wartime cluster.",
      "facts": ["Battle of Bennington casualty appears in genealogy narrative.", "Officer line paired with Lt. John Lane branch context."],
      "citations": [{ "label": "Lane war history page", "kind": "internal", "url": "/family/lane-war-history.html" }, { "label": "Lane Genealogies Vol. I", "kind": "book", "url": "https://archive.org/details/lanegenealogies01chap" }],
      "tags": ["revolution", "bennington", "officer"],
      "relatedCardIds": ["lt-john-lane-bennington"],
      "rarity": "rare",